"컨저링 시리즈 중에 주인공 부부가 돌아다닌 범위가 제일 컸다 이전 1,2와 달리 꽤 새로운 유형이어서 좋았다 다만 공포보다는 스토리에 집중한 느낌이다"
컨저링이 아닌 다른 이름으로 나왔으면 괜찮았을듯 평점이 왜 높은지 모르겠음
음...보고나서 기억나는건 데이빗 안경 이쁘다
무섭진않네요 스토리에 치중되있어.볼만합니다 긴장할필요는 없어요~
스포일러가 포함된 감상평입니다. 감상평 보기 컨저링 유니버스 팬으로써 영화에기대를 많이 했는데 별로 무섭지도 않고진부하고 루즈했어요 그나마 초반의 욕조씬과 빙의 장면이 제일 볼만했어요 다음 시리즈는 제임스 완이 감독을 맡았음 좋겠어요ㅠ 제발~~~
남주가 잘생겨서 몰입도 떨어짐 ㅋㅋ하이틴같음
코로나때문에 극장에 사람이 나밖에없었음 이런적 처음이라 초반엔 덜덜 떨면서 봤는데 컨저링시리즈중 제일 재미없고 개연성도없네요
기대하고 봤는데 스토리가 너무 실망이였어요. 학교괴담이 100배 더 무서운 듯 해요
갠적으론 3가 가장 좋았음.스토리적인면도 그렇고.
컨저링 시리즈 중 제일 덜 무섭 실화인건 신기
세련된 연출 이게 공포지
글쎄요.. 엑소시즘 영화를 하도 많이 봐서 그런지 무섭지도 않고 스토리도 뻔했어요 컨저링 이전작들 한번이라도 보신 분들은 전개 다 예상하실듯..
마지막 타임때 봐서 사람들없이 몰입해서 봤어요.보는 내내 크게 무섭다는 생각은 들지않았어요. 공포영화  잘 못보시는분들도 보실수 있을거에요.아 저는 그날 3년만에 엄마방에서 잤어요
공포영화를 잘 못 보는 타입이라서 무섭긴 무서웠습니다.  처음 오프닝 시퀀스가 확 휘어잡아서 좋았지만 뒤로 갈수록 그냥 그랬어요. 개연성도 딱히… 개인적으로 재밌게 보진 않았어요
공포영화 좋아하는데 별로 무섭지도않고처음보다 갈수록 지루했어요^^
아. 나의 그는 갔읍니다. 컨저링시리즈는 2에서 끝났어야했읍니다...
로맨스 드라마 근데 공포를 곁들인...
시리즈중 젤별로엿음 컨저링이라 믿고봤는데전체적인게 다 애매하네요 무섭지도 않고 지루하고 악마에 빙의된사람들이 좀비인줄알았어요ㅋㅋ특출난건 실화라는점 딱하나
사람의 마음속에 악마가 자리잡는 순간 그 공포는 배가 된다
솔직히 아무리 봐도 1이 제일 재밌엇음 3은 2보단 낫지만  끝에 갈수록...
안 무섭고 썩 재미도 없다. 신파 싫어하는 사람은 보지 마세요.
컨저링 개인적으로 1 그리고 2 는 정말 좋았고 내 최고의 공포영화 픽임 근데 3는 뭔가 좀 어영부영 이런 느낌에 공포감도 딱히 없는것 같음..
"확실히 이전 컨저링 시리즈에 비하면 많이 약함, 근데 얼마전에 개봉한 분노의질주에 비하면 엄청난 명작임은 확실하다!!!"
컨저링이 언제부터 좀비영화가 되었는지...
"생각했던 스토리가 아니네요 컨저링 시리즈랑 주인공만 같고 다른 영화로 봐도 무방할듯 합니다 컨저링 1, 2 를 기대하고 보신다면 실망할 듯 ... 그냥 그럭저럭 볼만합니다"
컨저링은 특유의 사운드로 긴장감을 일으키는 공포가 있었는데 이번에는 아무것도 없네요.
할리우드식 진행 ㅋㅋ 결국 사랑이 해결
악마가시키드나~~??
"1,2편과 비슷한 맥락의 호러물로 기대했건만..공포보다는 범죄스릴러? 너무 실화에 포커싱하다보니 군데군데 지루한 감이 있네요.근데 평점은 웰케 높지?"
무섭지도 않고 노잼 ㅡㅡ
이정도면 주인공이름만 실화를 바탕으로 한거 아니냐 ㅋㅋㅋ
그냥그냥 볼만함 나쁘지는 않음 시간 때우기 괜찮음근데 무서운거 잘보는 사람들한테는 지루하거나 별로라고 생각할수있음 난 적당히 재미있었음실화라는게 놀랍고
와 너무 재밌었습니다. 4편 나오면 무조건 볼듯 ㄷㄷ
ㅈ노잼ㅈ노잼ㅈ노잼ㅈ노잼ㅈ노잼
전 생각보다 더 재밌게 봤습니다
"개인적으론 2보다 재밌었다. 1>3>2 순으로 재밌는것 같음.. 1,2랑 느낌은 많이 다름. 셜록홈즈 공포버전 같은 느낌. 어니 잘생김"
어트케 시리즈가 갈수록 안무서워지냐  후반부는 그냥 스릴러에 가까움
역대최악 시리즈 처음과 끝만 기억 나머진 잤다 평점 높은것들은 죄다 알바냐
이번에 워렌부부가 다른 시리즈보다 실마리를 풀어나가는 과정이 디테일 했던거 같아요
공포 영화가 이정도면 완성도 높다고 생각함 다만 이번편은 컨저링스러운 공포랑은 좀 스타일이 달랐던거같음 그런 부분에서는 2프로 아쉬운 느낌이 있긴함 베댓에 개연성이 없다고 하는데 개연성 없는 부분은 딱히 없는듯 악마가 사람 괴롭히는데 이유없는데 사랑으로 저지안될 이유도 없고ㅋㅋ 충분히 재미있었음
중구가 시키드나?....
2보다는 덜 무섭지만 역시 공포영화중 최고의 퀄리티를 보장하는 컨저링
갑툭튀만있는 공포영화가 아니라 엑소시즘을 중심으로 영화가 전개돼서 넘 좋았음 갠적으로 컨저링 시리즈중 젤 재밌었던 듯 ㅠ 워렌부부 엑소시즘 얘기 더 풀어줬음 좋겠음ㅠㅠㅠ
감독이 바뀌니까 답이없네ㅋㅋㅋ 공포영화가 공포영화 다워야지
공포를 기대하면....안됨 TV과대광고가 영화를 망침(그래서 7점임 난 잠 못 잘 각오로 봤는데... 실망)스토리는 좋음
"스포일러가 포함된 감상평입니다. 감상평 보기 완성도는 떨어집니다... 초반 깜짝물, 중반 추리물 후반 개그물 5252 악마술사는 총따위 쓰지않아!!"
공포영화 좋아하는 분들은 하나도 무섭지 않게 보실 수 있습니다..호러 라기보다는 스릴러에 가까운 느낌이네요
270석 상영관인데 혼자봄    /   보기 전 : 아 이거 어쩌냐 혼자보다가 기절하면 어떡하지 ㅜㅜ ㄷㄷㄷ / 보고난 후 : 공포영환줄 알았는데 그냥 스릴러 영화네 괜히 쫌  역시 공포영화는 감독빨을 많이 타는구나.. 제임스완 돌아와요
영화가 왜 이렇게 착해져버렸을까?
2편보다 무섭진 않음. 맨 뒤에 실제 육성 녹음이 제일 무섭다.
스포일러가 포함된 감상평입니다. 감상평 보기 무섭지가 않음 ㅜㅜ 뜬금없이 로맨스영화가 되지를 않나 ㅋㅋㅋ 도대체 그여자는 왜 저주를 내린건지 모르겠네 중간에 딴생각해서 놓쳤나 ㅜ
"공포영화에서 사랑을 강요하니 뜬금 없고, 오컬트 수사물을 찍으니 어이가 없고, 이해할 수 없는 전개때문에 혼란하고, 제임스완이 메가폰을 잡지 않으면 컨저링 유니버스는 끝날 것 같다."
""
공포가 아니라 멜로영화였음.. 펑펑 울다 나옴
역시 연출은 제임스완 못따라오네 전작보다는 공포도가 낮음. 그러나 그럭저럭 볼만한듯
졸려서 좀 잣는데요 해피엔딩이엇네요 실화라는게 놀랍고요 남주가 잘생겻네요
"평점 9점대라서 기대좀 하고 봤는데 역시 연출은 제임스완 감독이 해야 맞는것 같습니다.솔직한 평은 9점대 까진 아닌것 같아요 제 개인적으론 컨저링 1,2가 훨씬 무섭고 재밌습니다임수완형 제발 제작만 하지말고 연출좀 해주이소"
전작들에 비해 가장 형편없음...
재미는 있는데 1도 안무서워요.. 이게 뭔 공포영화야 장난하나
스포일러가 포함된 감상평입니다. 감상평 보기 준구가...시..키드나 ???
완성도는 컨저링 3쫄깃한 긴장감은 컨저링2가 최고네요
역시 믿고보는컨저링 재밌습니다.
연출은 컨져링 유니버스 중에 제일 힘준거같긴한데.. 엔딩이 좀 어설펐어요 ㅜㅜ 그래도 워렌부부에 대한 의리로 봅니다
"컨저링1편 2편 에나벨, 더넌 까지 잼잇엇는데 3편은 뭔가 분리된 다른영화느낌이고 공포지수도 낮고 그냥 엑소시스트같은 느낌?  이라서 실망했어요.제임스완 감독이 만들어야햇어요!"
스포일러가 포함된 감상평입니다. 감상평 보기 그 큰 영화관에서 혼자 봤더니 내가 협심증 걸리겠네
중간 중간에 저장면 어떻게 찍었을까 하는 장면은 있었지만 무섭지는 않았다연기력은 짱짱
""
연기력 진짜..ㄷㄷ 내용도 무난하고 좋아요!!!
"너무 기대는 하지 말고 보세요.. ㅎㅎ 그래도 믿고보는 컨저링이여서 그냥 공포영화만큼만 만든거 같음. 스토리는 아쉽긴 했지만, 실화라는거부터 무서움이 들어가는거라.. 컨저링4도 기대합니다!"
컨저링 이번편도 워렌부부의 로멘스  재미있게 잘보았습니다. 공포 영화 장르를 분명 보았는데 훌쩍이면서 보았습니다  >_<
중간에 놀랄만한 장면들 몇몇 있어서 만족. 뻔한스토리지만 연출이 괜찮음
공포영화특징 처음은 무섭 갈수록 루즈 지루...급하게 절정되고 막내림
컨저링 시리즈중에 최고!! 깜놀 구간 많으니 주의!! 스토리가 일단 탄탄하게 흘러가면서 기승전결 구도 정확함!!무서운 장면은 많이 없으나 무서운 영화!! 꼭 영화관에서 보길 추천합니다!!
초반 재밌어서 기대했는데중반부터는 졸면서 봤네요좀 아쉬웠어요
2보다 3가 더 재있음. ㅋㅋ
그냥 그래요볼게 없으니 이거라도
컨저링 시리즈는 제임스 완 형만 만드는걸로
제가볼땐 평점을 악마가 조작하고있는거같습니다누가 이영화보자고하면 악마인지 의심해보세요
"가족애와 사랑의 가치를 알려주는 최고의 휴먼패밀리로멘스물인 ‘컨저링’ 시리즈. 보면서 크게 감동했고, 애정하는 시리즈긴 하지만 이제 슬슬 마무리를 짓는 것이 어떨까?^^;;"
"이제 갑툭튀 , 소리로 주는 공포가 익숙해져서인가 무서움이 1도 없었다 다만 실화라는 흥미로운 소재와 연기 ost가 좋아서 볼만한 정도..컨저링 유니버스 기대감이 이젠 없어져버렸네 쩝 이대로 시리즈는 그만 끝냈으면 좋겠다"
감독이 바뀌어서 상영전부터 그다지 기대는 안하긴했지만 그래도 기대보다 나은듯
제임스완이 연출했음 시리즈 명작공포영화였을텐데....컨저링의 명성을 깎아내버린 영화였다. 감독이 전작에는 요로나의 저주를 하더니 이번에는 컨저링에 저주를 내린거같다.
전편까지는 너무 무섭고 이랬는데 이편은 솔직히 기대 이하였습니다
로맨스가 섞여서 조금아쉽지만 나름 재밌어요!
주제 : 사랑의 힘은 위대하다.                                     기억나는거 : 남주랑 윌슨 학생때 개잘생겼다
"스토리가 너무 재미있고 영상미도 뛰어났습니다... 뭔가 되게 고급진 무서움으로 해야될까요...? 컨저링1,2,3도 통틀어서 봤던 공포영화중에 제일 재미있었네요"
무섭긴 드릅게 무서웠는데 너무 뜬금없는 사랑얘기 때문에 몰입도 깨짐
진짜...2 재밌게 봐서 기대했는데 걍 뻔하고...ㅜㅜ막 무섭다는 생각도 안들었음걍 공포영화보다는  사랑영화임ㅋ큐사랑만있으면 다해결할 수 있다구~~
공포영화는 다른거 다 제쳐두고 일단 무서워야 하는데 이 영화는 일단 안무서움...
이거 무섭다는 사람 나오세요... 저 개인적으로 컨저링시리즈 왕팬이였는데.. 이번3는 진짜 최악중에 최악임.. 1도 안무섭구요.. 시리즈중 2가 젤 무서움.. 수녀님 보고싶다..  10분마다 갑툭튀있다는 평점때문에 예매해서 본건데 뻥좀 작작쳐라.. 무서운장면 1도 없음 로미오줄리엣영화가 떠오르게 하는 러브신같은 스토리는 있네.. 설마 여기서 끝나나 싶었는데 진짜 화나더라.. 스토리가 너무 루즈하고 억지로 스토리설정한게 너무 보임 공포느끼고싶어서 공포영화본거지..누가 로맨스 법정드라마 보고싶다했나..  시리즈중 공포감 별점은 1로 하죠.. 그래도 하나 높은점을 주자면 로레인분 너무 연기잘하셔서 그건 다시 보고싶긴 하더라 악령퇴치성경주문외우면서 악령한테 외치는데 그건 진짜 너무 멋있었음 연기 진짜 젤 잘함
진짜 별로네요 초반 오프닝 때가 제일 무서워요 이건 뭐 공포인지 법정드라마인지 스릴러 범죄물인지 분간이 안가네요 확실한건 정말 1도 안무섭다는거... 오프닝신 때문에 별점 1점 더 줍니다
올해의 코미디영화상을 수상하기에 충분한 영화
"컨저링 시리즈 다봤는데 컨저링 3보면서 그냥 무섭다기보다는 소리로 깜짝깜짝 놀래키는 장면이 많음 그리고 중반부 넘어가면서 전개가 루즈해지면서 잠옴 왜 이렇게 재미가 없어졌지 하면서 보니까 감독이 1,2편 때랑 다르네요 여튼 저는 재미없었음"
컨저링은 2편에서 끝났다.
하……… 뭡니까 이게 팬티괴물나올때 망했다싶었음
재밌다고하는사람이 별로 없었지만 그냥 봤는데 재미없어요 여기서 재밌다고 하시는 분들은 대체 어느부분에서 재미를 느꼈는지 궁금할정도네요 ㅠ 뒤로갈수록 지루해서 하품만 계속하고왔어요 무서운거 개못보는 쫄본데도 무서운부분 하나도없고 깜짝놀래는 부분만 있고 암튼 보지마세요 돈낭비
처음 초반엔 좋았으나....중간부터는 진짜 개지루함^^ 본 사람들은 무슨말인지 알겠지만개연성이라고는 1도 찾아볼 수 없음. 감독 지딴엔 대본에 넣으면서까지 뭘 설명하고싶었나본데 전혀 와닿지도 않을뿐더러 뭔 개소린가 싶더라 진짜ㅋㅋㅋ진짜 이건 걍 배우들 연기가 다했다고 본다..전작 요로나의 저주 만 봐도 감독 수준 알만함
전작들에 비해 공포감과 깜놀 부분도 적어지고 뻔한 클리셰 장면들이 많이나와서 조금 실망함
개무서워 ㅅㅂ 혼자 궁뎅이 들썩여서 쪽팔림
스포일러가 포함된 감상평입니다. 감상평 보기 영화 마지막애 나오는 실화영상을 보는 게 제일 무서웠네요.
"로튼토마토, IMDb 해외 영화사이트에서는 컨저링 시리즈 최악의 점수인데 왜 네이버에서만 컨저링1,2를 훨씬 뛰어넘는 9.3점인지 이해도 안되고 실제로 보고 오니 더 이해가 안감내심 기대하고 영화관을 찾아갔지만 기존 컨저링 시리즈의 느낌은 온데간데 없고 그저그런 B급 호러영화 보는 느낌이었고 재미로 따지면 오히려 B급 호러영화만도 못했음초반에는 간만에 찾아간 영화관이라 공포영화 필수요소인 조용하다 갑자기 큰소리 나는 장면에서 한번 흠칫하고 공포감 긴장감 없는 귀신 등장에 그 이후에는 잠들지 않으려고 애썼던 기억뿐"
"컨저링1,2를 보지 않아도 이해가 가요.걍 다른 영화고, 러브스토리가 감동적이라서 눈물났어요"
개연성은 있어서 망작은 아니에요.귀신들 비쥬얼 보다는 사운드 때문에 놀란게 좀 많네요중간에 영안실 장면 좋았어요.갑분 사랑과 감동이 나와서 좀 당황스럽지만 그렇다고 개연성을 깨는 건 아니에요 돈이 아깝진 않은 영화입니다. 추천해용
스토리가 빈약하고 생각만큼 무섭지 않음. 그래서 그런지 일부러 쓸데없이 깜짝 놀라는 효과만 많이 넣은 듯. 그런부분에서 오히려 몰입도가 깨지고 재미가 반감됨. 기대하고가면 실망할 영화. 그리고 감동적으로 결말 맺은 것은 나쁘지 않았음. 내가 외로워서 그런지 역시 사랑은 위대하다 생각함. 아무튼 걍 나쁘진않고 쏘쏘한 영화.
개인적으로 초반 30분 이후로 쭉~ 지루했음. 결말은 뜬금없이 급마무리 되는 느낌? 컨저링 좋아했는데 이번편은 진짜 말잇못... 주인공 부부 둘의 사랑이 얼마나 끈끈한지는 절실히 깨달음요
클라이맥스 부분에 어설픈 휴머니즘만 아녔음 8~9점 줬다..
무서웠어요! 영화보는 내내 긴장되서 불편했지만 앞쪽 여학생들도 무섭다고 쑤군쑤군.. 2021년 판이라 사운드도 크고 세밀해 그런 요소들이 한층 더 분위기를 압도함. 여름에 시원하게 볼만한 공포물이네요. 보고나면 대체로 만족.
"스포일러가 포함된 감상평입니다. 감상평 보기 뚱땡이 괴물 어쩔... 제임스완 감독이 맡은 컨저링 1,2편의 손톱정도ㅎㅎ 평점알바를 쓰는건가..."
혼자 영화관에서 봤는데 진짜 재밌음 하나도 안지루하던데 ㅋㅋ
남주가 잘생겨서 눈호강함ㅎㅎ
"공포,스릴러,멜로가 적절히 가미됨...보는내내 긴장감이 았어 좋았음..."
재밌어용 커플은 좀 화나는뎅 ㅠ
진짜 ㄹㅈㄷ 전 너무너무 재미있었어요  !?? !??처음 부터 무섭....진짜 무서웠어요.... 마지막쯤에 진짜 심장 덜컹덜컹 했쑴다..
저는 너무 재밌게 봤어요^^깜짝놀라는 비중이 기존 스토리들보단 적었지만역시나 재미있네요ㅎㅎㅎ어니 완내스~♡
질질끌어서 지루한감은 있는데 볼민해요.
"실화를 소재로 만든건 이해하지만, 스마트폰 시대에 악령은 호응도가 낮다."
심장 튀어나오는줄...
영화를 보면서 심장과 몸이 쪼그라든 기분이에용ㅎ 무섭지만 몰입도 높고 재밌게 볼만해요!!! 깜짞깜짞놀라는 부분이 많았어용 추추
그냥 사바하나 검은 사제들을 한번 더 보는 것을 추천합니다. 유전도 한번 더 보세요. 이번 컨저링3는 그저 그렇네요
기대 이상으로 재미있었고 무서웠습니다.
"오랜만에 본 영화에요 컨저링 시리즈,,기대만큼 좋았습니다 오싹하고 무서웠어요 유치하지 않고 내용이 그럴듯해 몰입도도 좋았고 특유의 공포스런 분위기가 있었네요"
무난했음 개인적으로 잼나게 본 순서는 2>1>3인듯
컨저링3컨저링3컨저링3
재밌어용 ㅎㅎㅎ
김정우가 보고 싶다고 해서 시즈니인 내가 대신 보고 온 후기 정우야 보고있니?? 무서워 ㅋㅋㅋ 정우야 생각 백번 하고 봐야해~!~!~!~!~!~!
재밌었어요! 꼭 보세요! 남자친구랑 갔는데 남자친구가 더 놀랬네요...ㅎㅎ
스포일러가 포함된 감상평입니다. 감상평 보기 컨저링3: 악마가시켰다 x컨저링3: power of love o
컨저링만의 이 뭔가 참을 수 없는 무게감
쉴틈없는 공포조성 워렌부부역 맡은 두분의 연기력은 1편부터 말할필요 없음
좀비물&로맨스&호러 모두를 잡으려고 노력했으나 글쎄...컨저링은 본편이랑 파생시리즈도 다 봤는데 이번편이 역대 시리즈 중 가장 안무서웠음.. 배후가 사람이라 그런가... 공포영화의 탈을 쓴 기승전 사랑의 영능력 수사물
제임스완 특유의 분위기가 싹 가라앉아서 실망스러웠지만 3편치고는 그럭저럭 볼만한 영화
모야 ;;안무섭네....엄마랑 같이 자야지~~
"1봤을때 너무너무너무 재밌게 봤습니다.2봤을때는 삐에로할어버지? 강아지가 막 변하는거 보고 쫌 별로라고 생각했지만 그래도 재밌게 봤습니다. 2의삐에로 할어버지 같은 뚱땡이 좀비가 좀 튀는 부분이 있긴 하지만 스토리랑 연출이 1,2보다 훨씬 깔끔하고 돈좀 썼다? 생각이 들더군요. 1,2 재미있게 보셨다면 3도 재미있게 보실거라 믿어 의심치 않습니다.  솔직히 절벽에서 발 잡아 당길때 심장 멈출뻔... 너무 방심했어.. ㅇㅈ?"
꼭 보세요.. 공포 좋아하시는분들
공포영화 무서워하시는분은 보지마세요.전보다 너무놀래서 어깨담왔어요영화보는 내내 귀막았다 눈감았다...아  왜받을까.ㅋㅋㅋ공포좋아하시는분들 꼭보세요^^
1.2편은무섭게봤는데 이번3편도무서웠지만기대했던거와다르게 많이무섭진않았어요ㅠㅠ
약간 지루한 감이 있음.. 대화를 너무 많이 한달까... 그리고 뭔가 감독이 일단 러닝타임은 맞춰야 되니까 일을 엄청 벌려놓고 갑자기 끝낸 느낌...?
중간까지 재밌고 후반부는 뻔했다
컨저링 시리즈 중 제일 안 무섭고 공포영화보면서 처음으로 하품함 ㅇㅇ; 그냥 딱 사랑의 힘으로 악을 타개한다 이 느낌
제임스 완... 돌아와주세요...
적당히 무서웠고 볼만했지만 후반부가 조금 아쉬워요
공포영화는 집에서 TV로는 많이 봤는데 영화관에서 처음봤는데 나는 공포영화를 잘 보는 줄 알았는데 이번에 컨저링 보면서 겁나 못보는 걸알게 되었다 거의 1분에 한번씩 무서운게 나오는거 같았다 그리고 영화관에 한 20명 정도 있었는데 나만 소리질렀다....넘 무서워서 주변 신경쓸겨를이 없었다 3명이서 보러갔는데 셋다 눈가리면서 영화봤다 ㅋㅋ나중에 컨저링4 나오면 또 볼것이다. 5시 영화여서 7시에 끝났는데 좀 무서웠다. 다음 공포영화 볼때는 낮에 볼 것이다. 그리고 처음영화관에서 공포영화 보는 분께 추천 한다 왜냐면 이걸보고 아 이런게 공포영화구나라고 뼈져리게 느겨지기 때문이다 나는 조금 눈물도 흘렸다...이걸 내가 왜보고 있지라고 생각하면서.
스릴을 느끼러 왔지만 로맨스를 얻고가는 영화결론:알바가 많다
배우들 연기가  그냥 대박임ㅋㅋㅋ
나 같은 솔로가 저주에 걸리면 죽을수 밖에 없다는걸 느끼게 해준 영화
공포영화를 보는건지 사랑영화를 보는건지.... 마지막에 좀 감동 한스푼
공포를 느끼고싶었는데 무섭질않네..볼만합니다.
첨부터 끝까지 긴장하고 봤어요~공포영화중 3손가락에 꼽을정도로 잼있었는데 실화라는거에 더 놀랬어요
초반부 공포씬은 좋았지만 후반부와 결말이 아쉽다
챙겨 보는 공포 영화 컨저링이 돌아왔다. 제임스 완 감독이 아니라서 살짝 기대치를 내렸으니 역시나 컨저링은 무섭구나. 실화라 더 무서워...  정말 이런일이 실제로 일어나다니 생각만해도 등골이 오싹.  컨저링은 마지막에 영화 배경이된 실제 가족들 사진이나 실제 퇴마 음성 녹음 틀어주지만 실화라 믿고 싶지 않을정도로 너무무무 무서워....
The Conjuring: The Devil Made Me Do It
무서움이 빠지고 지루함과 재미가 추가됨
전작들에 한참 못미치고 상당히 지루했음공짜표로 관람했음에도 아직까지 가시지 않는 분노 ㅎㄷㄷ
무서움보단 감동적인면이 더 큰듯
"인천송도 cgv 8시 40분에 영화보던 &#39;여자&#39;님 ㅋ 알람인지 플레쉰지 ㅈㄴ 터트리던데 뭐하는 사람임? 한두번이 아니라 4,5번이던데 그럴꺼면 집에 가서 처보던가 ㅋㅋ 그리고 늦게 들어온사람이 10명정도 넘던데 그럴꺼면 상영시간 왜 정함? 자기들 시간날때 들르게 만들던가 ㅋㅋ 무개념도 한두명이야지 ㅋㅋ 지 화장실가는데 친구는 왜 데려감 ㅋㅋ 볼때마다 참ㅋㅋ"
컨저링 전편들보다는 기대이하였던거 같아요. 뭔가 예상되는 스토리..
"-2점은 무서움에서 깎인 것.+8점은 워렌부부 젊을때 연애하는 장면, 전체적인 스토리, 배우 연기, 효과음, 몰입도/ 오늘 보고온 인데요! 영화는 볼만했어요 하지만 갑툭튀는 나오기는 한데 대부분 효과음때문에 쫄았구여! 생각보다 무서운 장면이 무섭지 않았어요! 그리고 내용위주로 많이나와서 지루함을 느끼긴 했어요아무튼 볼만한 공포물이였어요 잘봤어요~ 컨저링 감독님!"
오늘의 한줄평갓폴리스
이거 좀비영화였어? ...
공포영화가 아니라 추리영화임 추리영화로선 나름 긴장감있으나 공포영화로선 긴장을 놓는구간이 많았음
무서웠다.. 결말은 다소 다급했지만 좋았다
무슨영화든 1편이재밋는건 맞는듯..ㅠ
개꿀잼 개 꾸 울 재 앰 뚜두둗 구
와 재밌게 봤네요.  뭐 기존 컨저링과 색이 좀 다르다는말도 있는데 .2시간이 어떻게 흐른지도 모를 정도로 진짜 재밌게 보고 나왔어요.   생각보다 좋았어요
영상미가 영화의 부족한면을 다 덮었다.
역시 기대를 저버리지않아~~
지루해서 보다가 좀 졸았어요
""
깜짝깜짝 놀라는 부분도 많고 컨저링시리즈중 제일 재밌었어요 사랑얘기도 개인적으로 공포도  주고 슬픈감동도 주는 영화였습니다
"컨저링  1,2  영화관에서 본 사람 입니다.하나도 안 무서웠습니다.  귀막고 보았습니다.옆에 9시간 운전하고 영화 보러온 친구도 졸다가 깜짝 놀라경기 일으켰습니다."
제임스완의 컨저링이 항상 그립구나
진짜 이때까지 컨저링규모와 다르게 커서 재밌었음 ㅠㅠ꼭추천!
그냥 로맨스물이에요 목걸이 차고 가시면 더 몰입될듯ㅎㅎ
"개인적으로 1,2편보다 안무섭고... 그냥 스릴러 느낌이에요"
"공포영화 답지 않는 포근함,어드벤쳐"
잘 만든 공포영화. 잘 보고 왔음
